Capability,Phase,Cisco Firewall (ASA/NGFW),Guardicore,Okta,Palo Alto Firewall,Rapid7 InsightVM,SentinelOne,Wiz.io,Zscaler Internet Access (ZIA)
Access Vulnerability Management System Logs (C1013),Preparation,,,,,x,x,,
Access External Flow Logs (C1101),Preparation,x,,,x,,,,
Access Internal Flow Logs (C1102),Preparation,x,,,x,,,,
Access Internal HTTP Logs (C1103),Preparation,x,,,x,,x,,
Access External HTTP Logs (C1104),Preparation,x,,,x,,x,,x
Access Internal DNS Logs (C1105),Preparation,x,,,x,,x,,
Access External DNS Logs (C1106),Preparation,x,,,x,,x,,x
Access VPN Logs (C1107),Preparation,,,,,,,,
Access DHCP Logs (C1108),Preparation,,,,,,,,
Access Internal Packet Capture Data (C1109),Preparation,x,,,x,,,,
Access External Packet Capture Data (C1109),Preparation,x,,,x,,,,
List Alert Victims (C2001),Identification,,,,,,x,,
List Host Vulnerabilities (C2002),Identification,,,,,x,x,x,
List Registry Key Modifications (C2501),Identification,,,,,,x,,
Report Incident to External Entity (C4001),Eradication,,,,,,,,
Remove Rogue Network Device (C4101),Eradication,,,,,,,,
Delete Email Message (C4201),Eradication,,,,,,,,
Remove File (C4301),Eradication,,,,,,,,
Remove Registry Key (C4501),Eradication,,,,,,,,
Remove Service (C4502),Eradication,,,,,,,,
Revoke Authentication Credentials (C4601),Eradication,,,,,,,,
Remove User Account (C4602),Eradication,,,,,,,,
Reinstall Host from Golden Image (C5001),Recovery,,,,,,,,
Restore Data from Backup (C5002),Recovery,,,,,,,,
Unblock Blocked IP (C5101),Recovery,,,,,,,,
Unblock Blocked Domain (C5102),Recovery,,,,,,,,
Unblock Blocked URL (C5103),Recovery,,,,,,,,
Unblock Blocked Port (C5104),Recovery,,,,,,,,
Unblock Blocked Port (C5105),Recovery,,,,,,,,
Unblock Domain on Email (C5201),Recovery,,,,,,,,
Unblock Sender on Email (C5202),Recovery,,,,,,,,
Restore Quarantined Email Message (C5203),Recovery,,,,,,,,
Restore Quarantined File (C5203),Recovery,,,,,,,,
Unblock Blocked Process (C5401),Recovery,,,,,,,,
Enable Disabled Service (C5501),Recovery,,,,,,,,
Unlock Locked User Account (C5601),Recovery,,,,,,,,